{
  "schema_version": "1.0-draft",
  "artifact_version": "1",
  "status": "confirmed",
  "work_id": "lotm",
  "source_id": "en",
  "chapter": 1,
  "raw_epub_sha256": "452d90496d8dc6db4a96ef4d817eaa24c5baea62ab629af27bb8abdc0b25eb1d",
  "extraction_profile": "epub-dom-physical-blocks/1",
  "toc_index": 4,
  "toc_label": "Chapter 1: Crimson",
  "toc_href": "EPUB/text/ch005.xhtml#chapter-1-crimson",
  "segments": [
    {
      "document_href": "EPUB/text/ch005.xhtml",
      "spine_index": 6,
      "start_dom_path": "/html[1]/body[1]/section[1]",
      "end_dom_path": null
    }
  ],
  "paragraphs": [
    {
      "fragments": [
        {
          "document_href": "EPUB/text/ch005.xhtml",
          "spine_index": 6,
          "dom_path": "/html[1]/body[1]/section[1]/h2[1]",
          "element_tag": "h2",
          "document_sha256": "f826996c7ceec75c7eeeb6f25ca0c92521ab53430e54541a73c060c7dd035799",
          "fragment_sha256": "b90e9f0108457f2115107ade81d7911397984223c045d37b553bfb06063bf32e",
          "structural_type": "heading",
          "has_ruby": false
        }
      ]
    },
    {
      "fragments": [
        {
          "document_href": "EPUB/text/ch005.xhtml",
          "spine_index": 6,
          "dom_path": "/html[1]/body[1]/section[1]/p[1]",
          "element_tag": "p",
          "document_sha256": "f826996c7ceec75c7eeeb6f25ca0c92521ab53430e54541a73c060c7dd035799",
          "fragment_sha256": "e6aa9d0226aa62649e7feaf7fffbc718cefcf2881d36c8559972356735413305",
          "has_ruby": false
        }
      ]
    },
    {
      "fragments": [
        {
          "document_href": "EPUB/text/ch005.xhtml",
          "spine_index": 6,
          "dom_path": "/html[1]/body[1]/section[1]/p[2]",
          "element_tag": "p",
          "document_sha256": "f826996c7ceec75c7eeeb6f25ca0c92521ab53430e54541a73c060c7dd035799",
          "fragment_sha256": "9ed6b902b03830112d2a09dd6931e6baecd25050b912887dde94883f925aa60d",
          "has_ruby": false
        }
      ]
    },
    {
      "fragments": [
        {
          "document_href": "EPUB/text/ch005.xhtml",
          "spine_index": 6,
          "dom_path": "/html[1]/body[1]/section[1]/p[3]",
          "element_tag": "p",
          "document_sha256": "f826996c7ceec75c7eeeb6f25ca0c92521ab53430e54541a73c060c7dd035799",
          "fragment_sha256": "f510dd90db4b0701f914572b3d6b43ccb2cd1de9c5fb13e07b6fca9e6a0adb17",
          "has_ruby": false
        }
      ]
    },
    {
      "fragments": [
        {
          "document_href": "EPUB/text/ch005.xhtml",
          "spine_index": 6,
          "dom_path": "/html[1]/body[1]/section[1]/p[4]",
          "element_tag": "p",
          "document_sha256": "f826996c7ceec75c7eeeb6f25ca0c92521ab53430e54541a73c060c7dd035799",
          "fragment_sha256": "acb9df38d189fba65258e20a0fee116c5f48f83861ff8bd83bd93b2fd8ee73c5",
          "has_ruby": false
        }
      ]
    },
    {
      "fragments": [
        {
          "document_href": "EPUB/text/ch005.xhtml",
          "spine_index": 6,
          "dom_path": "/html[1]/body[1]/section[1]/p[5]",
          "element_tag": "p",
          "document_sha256": "f826996c7ceec75c7eeeb6f25ca0c92521ab53430e54541a73c060c7dd035799",
          "fragment_sha256": "b314859c781528b71d5d0161060408a8bf637d381a004b9c5af21702f32f9e58",
          "has_ruby": false
        }
      ]
    },
    {
      "fragments": [
        {
          "document_href": "EPUB/text/ch005.xhtml",
          "spine_index": 6,
          "dom_path": "/html[1]/body[1]/section[1]/p[7]",
          "element_tag": "p",
          "document_sha256": "f826996c7ceec75c7eeeb6f25ca0c92521ab53430e54541a73c060c7dd035799",
          "fragment_sha256": "c99a0614d8f1064d9493f653991e38a02d5b8f02b6b273772849db72f8a590ce",
          "has_ruby": false
        }
      ]
    },
    {
      "fragments": [
        {
          "document_href": "EPUB/text/ch005.xhtml",
          "spine_index": 6,
          "dom_path": "/html[1]/body[1]/section[1]/p[8]",
          "element_tag": "p",
          "document_sha256": "f826996c7ceec75c7eeeb6f25ca0c92521ab53430e54541a73c060c7dd035799",
          "fragment_sha256": "10b88848ea6689a3bd379e4ef34dbb61843ec12864c5ed6e7f51d16323d96dba",
          "has_ruby": false
        }
      ]
    },
    {
      "fragments": [
        {
          "document_href": "EPUB/text/ch005.xhtml",
          "spine_index": 6,
          "dom_path": "/html[1]/body[1]/section[1]/p[9]",
          "element_tag": "p",
          "document_sha256": "f826996c7ceec75c7eeeb6f25ca0c92521ab53430e54541a73c060c7dd035799",
          "fragment_sha256": "746635d15337c6ecb6984645b69e1b7af820cd6e37dc6b0fbfa6b917ccbea4bf",
          "has_ruby": false
        }
      ]
    },
    {
      "fragments": [
        {
          "document_href": "EPUB/text/ch005.xhtml",
          "spine_index": 6,
          "dom_path": "/html[1]/body[1]/section[1]/p[10]",
          "element_tag": "p",
          "document_sha256": "f826996c7ceec75c7eeeb6f25ca0c92521ab53430e54541a73c060c7dd035799",
          "fragment_sha256": "c4dc9ef04573b709e9b08c50cfb961547a1ea3345f2f3388cfb7e2351466e180",
          "has_ruby": false
        }
      ]
    },
    {
      "fragments": [
        {
          "document_href": "EPUB/text/ch005.xhtml",
          "spine_index": 6,
          "dom_path": "/html[1]/body[1]/section[1]/p[11]",
          "element_tag": "p",
          "document_sha256": "f826996c7ceec75c7eeeb6f25ca0c92521ab53430e54541a73c060c7dd035799",
          "fragment_sha256": "d92c2cf6740312912b568d82eb6a5b3ffa99e8e977d662a6d6176453e77704dd",
          "has_ruby": false
        }
      ]
    },
    {
      "fragments": [
        {
          "document_href": "EPUB/text/ch005.xhtml",
          "spine_index": 6,
          "dom_path": "/html[1]/body[1]/section[1]/p[12]",
          "element_tag": "p",
          "document_sha256": "f826996c7ceec75c7eeeb6f25ca0c92521ab53430e54541a73c060c7dd035799",
          "fragment_sha256": "59fa19192bdb23c31b9566bc7cbcc8e580c53c6af0025c636fa63c89cb17dfc1",
          "has_ruby": false
        }
      ]
    },
    {
      "fragments": [
        {
          "document_href": "EPUB/text/ch005.xhtml",
          "spine_index": 6,
          "dom_path": "/html[1]/body[1]/section[1]/p[13]",
          "element_tag": "p",
          "document_sha256": "f826996c7ceec75c7eeeb6f25ca0c92521ab53430e54541a73c060c7dd035799",
          "fragment_sha256": "532c2329397b31fdce7fa2bec0c4da95313f8dbd6221d34c5223dd71614d003c",
          "has_ruby": false
        }
      ]
    },
    {
      "fragments": [
        {
          "document_href": "EPUB/text/ch005.xhtml",
          "spine_index": 6,
          "dom_path": "/html[1]/body[1]/section[1]/p[14]",
          "element_tag": "p",
          "document_sha256": "f826996c7ceec75c7eeeb6f25ca0c92521ab53430e54541a73c060c7dd035799",
          "fragment_sha256": "4191fa0146e98c6b121a4f3be1c8c8f4a130dd48b993e287427e30cd09e19d9b",
          "has_ruby": false
        }
      ]
    },
    {
      "fragments": [
        {
          "document_href": "EPUB/text/ch005.xhtml",
          "spine_index": 6,
          "dom_path": "/html[1]/body[1]/section[1]/p[15]",
          "element_tag": "p",
          "document_sha256": "f826996c7ceec75c7eeeb6f25ca0c92521ab53430e54541a73c060c7dd035799",
          "fragment_sha256": "f2db64f8596043d3d9b0564d92c950bc8ad2711887b8781e1981f65ee7bc3fd3",
          "has_ruby": false
        }
      ]
    },
    {
      "fragments": [
        {
          "document_href": "EPUB/text/ch005.xhtml",
          "spine_index": 6,
          "dom_path": "/html[1]/body[1]/section[1]/p[16]",
          "element_tag": "p",
          "document_sha256": "f826996c7ceec75c7eeeb6f25ca0c92521ab53430e54541a73c060c7dd035799",
          "fragment_sha256": "4101a1b3983a203fa079b3772d9546e668639b379f63b62416588ac579183dcf",
          "has_ruby": false
        }
      ]
    },
    {
      "fragments": [
        {
          "document_href": "EPUB/text/ch005.xhtml",
          "spine_index": 6,
          "dom_path": "/html[1]/body[1]/section[1]/p[17]",
          "element_tag": "p",
          "document_sha256": "f826996c7ceec75c7eeeb6f25ca0c92521ab53430e54541a73c060c7dd035799",
          "fragment_sha256": "59ac9be78d91b0f2fdf5cf14f72a0d30e93ca2aa3a59decdad29cad38d6f3c85",
          "has_ruby": false
        }
      ]
    },
    {
      "fragments": [
        {
          "document_href": "EPUB/text/ch005.xhtml",
          "spine_index": 6,
          "dom_path": "/html[1]/body[1]/section[1]/p[18]",
          "element_tag": "p",
          "document_sha256": "f826996c7ceec75c7eeeb6f25ca0c92521ab53430e54541a73c060c7dd035799",
          "fragment_sha256": "b15674d47af1bf1e28e2d003e7a4c6f848d2d23969562cf1f0b7a487768df2f1",
          "has_ruby": false
        }
      ]
    },
    {
      "fragments": [
        {
          "document_href": "EPUB/text/ch005.xhtml",
          "spine_index": 6,
          "dom_path": "/html[1]/body[1]/section[1]/p[19]",
          "element_tag": "p",
          "document_sha256": "f826996c7ceec75c7eeeb6f25ca0c92521ab53430e54541a73c060c7dd035799",
          "fragment_sha256": "2fd92bf5adb2a7ff0e7bcce1447573b3e1a03947694ac2f4f2a4e2552dd22aec",
          "has_ruby": false
        }
      ]
    },
    {
      "fragments": [
        {
          "document_href": "EPUB/text/ch005.xhtml",
          "spine_index": 6,
          "dom_path": "/html[1]/body[1]/section[1]/p[20]",
          "element_tag": "p",
          "document_sha256": "f826996c7ceec75c7eeeb6f25ca0c92521ab53430e54541a73c060c7dd035799",
          "fragment_sha256": "e982da72c697091328006beb05239df778c76372e9f950d8669614c593f04348",
          "has_ruby": false
        }
      ]
    },
    {
      "fragments": [
        {
          "document_href": "EPUB/text/ch005.xhtml",
          "spine_index": 6,
          "dom_path": "/html[1]/body[1]/section[1]/p[21]",
          "element_tag": "p",